{
  "$schema": "https://json-schema.org/draft/2020-12/schema",
  "additionalProperties": false,
  "properties": {
    "createdHlc": {
      "additionalProperties": false,
      "properties": {
        "logical": {
          "maximum": 4294967295,
          "minimum": 0,
          "type": "integer"
        },
        "node": {
          "pattern": "^[0-9a-f]{8}-[0-9a-f]{4}-7[0-9a-f]{3}-[89ab][0-9a-f]{3}-[0-9a-f]{12}$",
          "type": "string"
        },
        "physicalMs": {
          "pattern": "^(?:0|[1-9][0-9]{0,18}|1[0-7][0-9]{18}|18[0-3][0-9]{17}|184[0-3][0-9]{16}|1844[0-5][0-9]{15}|18446[0-6][0-9]{14}|184467[0-3][0-9]{13}|1844674[0-3][0-9]{12}|184467440[0-6][0-9]{10}|1844674407[0-2][0-9]{9}|18446744073[0-6][0-9]{8}|1844674407370[0-8][0-9]{6}|18446744073709[0-4][0-9]{5}|184467440737095[0-4][0-9]{4}|18446744073709550[0-9]{3}|18446744073709551[0-5][0-9]{2}|1844674407370955160[0-9]|1844674407370955161[0-5])$",
          "type": "string"
        }
      },
      "required": [
        "physicalMs",
        "logical",
        "node"
      ],
      "type": "object"
    },
    "exportId": {
      "pattern": "^[0-9a-f]{8}-[0-9a-f]{4}-7[0-9a-f]{3}-[89ab][0-9a-f]{3}-[0-9a-f]{12}$",
      "type": "string"
    },
    "format": {
      "const": "context-relay.export.v1"
    },
    "operationOrder": {
      "items": {
        "pattern": "^[0-9a-f]{8}-[0-9a-f]{4}-7[0-9a-f]{3}-[89ab][0-9a-f]{3}-[0-9a-f]{12}$",
        "type": "string"
      },
      "maxItems": 10000,
      "type": "array",
      "uniqueItems": true
    },
    "records": {
      "items": {
        "additionalProperties": false,
        "properties": {
          "encryptedPayload": {
            "maxLength": 5592406,
            "pattern": "^(?:[A-Za-z0-9_-]{4})*(?:[A-Za-z0-9_-][AQgw]|[A-Za-z0-9_-]{2}[AEIMQUYcgkosw048])?$",
            "type": "string"
          },
          "provenance": {
            "additionalProperties": false,
            "properties": {
              "createdHlc": {
                "additionalProperties": false,
                "properties": {
                  "logical": {
                    "maximum": 4294967295,
                    "minimum": 0,
                    "type": "integer"
                  },
                  "node": {
                    "pattern": "^[0-9a-f]{8}-[0-9a-f]{4}-7[0-9a-f]{3}-[89ab][0-9a-f]{3}-[0-9a-f]{12}$",
                    "type": "string"
                  },
                  "physicalMs": {
                    "pattern": "^(?:0|[1-9][0-9]{0,18}|1[0-7][0-9]{18}|18[0-3][0-9]{17}|184[0-3][0-9]{16}|1844[0-5][0-9]{15}|18446[0-6][0-9]{14}|184467[0-3][0-9]{13}|1844674[0-3][0-9]{12}|184467440[0-6][0-9]{10}|1844674407[0-2][0-9]{9}|18446744073[0-6][0-9]{8}|1844674407370[0-8][0-9]{6}|18446744073709[0-4][0-9]{5}|184467440737095[0-4][0-9]{4}|18446744073709550[0-9]{3}|18446744073709551[0-5][0-9]{2}|1844674407370955160[0-9]|1844674407370955161[0-5])$",
                    "type": "string"
                  }
                },
                "required": [
                  "physicalMs",
                  "logical",
                  "node"
                ],
                "type": "object"
              },
              "harness": {
                "oneOf": [
                  {
                    "type": "null"
                  },
                  {
                    "enum": [
                      "claude_code",
                      "codex",
                      "hermes",
                      "opencode"
                    ]
                  }
                ]
              },
              "originDevice": {
                "pattern": "^[0-9a-f]{8}-[0-9a-f]{4}-7[0-9a-f]{3}-[89ab][0-9a-f]{3}-[0-9a-f]{12}$",
                "type": "string"
              },
              "source": {
                "oneOf": [
                  {
                    "type": "null"
                  },
                  {
                    "additionalProperties": false,
                    "properties": {
                      "recordId": {
                        "pattern": "^[0-9a-f]{8}-[0-9a-f]{4}-7[0-9a-f]{3}-[89ab][0-9a-f]{3}-[0-9a-f]{12}$",
                        "type": "string"
                      },
                      "source": {
                        "const": "record"
                      }
                    },
                    "required": [
                      "source",
                      "recordId"
                    ],
                    "type": "object"
                  },
                  {
                    "additionalProperties": false,
                    "properties": {
                      "packageId": {
                        "pattern": "^[0-9a-f]{8}-[0-9a-f]{4}-7[0-9a-f]{3}-[89ab][0-9a-f]{3}-[0-9a-f]{12}$",
                        "type": "string"
                      },
                      "source": {
                        "const": "package"
                      }
                    },
                    "required": [
                      "source",
                      "packageId"
                    ],
                    "type": "object"
                  }
                ]
              }
            },
            "required": [
              "originDevice",
              "harness",
              "source",
              "createdHlc"
            ],
            "type": "object"
          },
          "recordId": {
            "pattern": "^[0-9a-f]{8}-[0-9a-f]{4}-7[0-9a-f]{3}-[89ab][0-9a-f]{3}-[0-9a-f]{12}$",
            "type": "string"
          },
          "recordKind": {
            "enum": [
              "memory",
              "memory_candidate",
              "task",
              "secret_ref",
              "instruction",
              "component",
              "project"
            ]
          },
          "revision": {
            "pattern": "^[0-9a-f]{8}-[0-9a-f]{4}-7[0-9a-f]{3}-[89ab][0-9a-f]{3}-[0-9a-f]{12}$",
            "type": "string"
          },
          "tombstone": {
            "type": "boolean"
          }
        },
        "required": [
          "recordId",
          "recordKind",
          "revision",
          "tombstone",
          "provenance",
          "encryptedPayload"
        ],
        "type": "object"
      },
      "maxItems": 10000,
      "type": "array"
    },
    "workspaceId": {
      "pattern": "^[0-9a-f]{8}-[0-9a-f]{4}-7[0-9a-f]{3}-[89ab][0-9a-f]{3}-[0-9a-f]{12}$",
      "type": "string"
    }
  },
  "required": [
    "format",
    "exportId",
    "workspaceId",
    "createdHlc",
    "records",
    "operationOrder"
  ],
  "type": "object"
}
